{
  "taskId": "F13-MOBILE-BUILD-BASELINE-20260824",
  "issueId": "F13-MOBILE-BUILD-BASELINE",
  "outcome": "SUCCESS",
  "summary": "Rework 2 removed the quick-navigation stray JSX text and adds an original-Babel-AST traversal contract that rejects non-whitespace JSXText outside Text. Calendar remains an empty-state shell without fixtures; auth/files, bundle, and wrapper recovery remain intact.",
  "reportPath": ".agents/moaworks-subagent/reports/F13-MOBILE-BUILD-BASELINE-20260824.md",
  "modifiedFiles": ["frontend/mobile-app/App.tsx", "frontend/mobile-app/test/mobile-build-contract.test.js", "docs/work-progress/moaworks-completion-v2.1/progress.jsonl", "docs/work-progress/moaworks-completion-v2.1/stage-04-f12-f14/progress.jsonl", "docs/work-progress/mobile-android-2026-08-21-update.jsonl", ".agents/moaworks-subagent/reports/F13-MOBILE-BUILD-BASELINE-20260824.md", ".agents/moaworks-subagent/results/F13-MOBILE-BUILD-BASELINE-20260824/result.latest.json"],
  "verification": [
    { "command": "node --test test/mobile-build-contract.test.js", "result": "PASS 12/12" },
    { "command": "npm test", "result": "PASS 61/61" },
    { "command": "@babel/parser AST traversal of App.tsx", "result": "PASS; no non-whitespace JSXText exists outside Text" },
    { "command": "node --check scripts/mobile-app-build-smoke.js && node --check scripts/mobile-android-command.js && node --check auth-session.js", "result": "PASS" },
    { "command": "npm run bundle", "result": "PASS exit 0; SHA256 4d11d585b029d0336f6791f077b2cdb3869e5da2f7ee3644728bec8c17ecc972" },
    { "command": "npm run build:android", "result": "Gradle release bundle task observed and release APK exists (59169514 bytes); final executor exit was not returned" },
    { "command": "git diff --check and forbidden-marker scan", "result": "PASS" }
  ],
  "remaining": ["Android command final exit code was not returned by the executor; rerun in a persistent terminal before claiming release-build completion.", "Physical device install/launch was not run."],
  "directCause": "A complete phase build script had been appended after the coherent smoke flow, leaving undefined nowIso/logLines/runId/safeSha256/findExecutable/runCommand/reportPath references.",
  "evidence": ["RED AST violation value ) : null}", "GREEN AST contract", "npm test 61/61", "bundle STATUS=success with SHA-256 log", "release APK observed"],
  "attemptedAlternatives": ["Used the 544d42c coherent smoke flow as the minimal reference instead of repairing individual stale helper references.", "Waited and monitored the Android Gradle process; recorded APK observation without inventing an unavailable final exit code."],
  "currentState": "Production bundle and original-AST verification are green. Android release APK is present but final command exit and device validation remain unverified.",
  "remediationProposal": "Run npm run build:android in a persistent terminal, capture its final exit code, then install and launch on an authorized device or emulator.",
  "resumePoint": "Start with Android release exit/device verification; no product-code change is pending.",
  "scopeChange": false,
  "requirementChange": false,
  "majorRiskChange": false
}
