{"taskId":"F13-MOBILE-DIRECTORY-API-20260824","issueId":"F13-MOBILE-DIRECTORY-API","outcome":"SUCCESS","summary":"주소록 API wiring과 독립 리뷰 보완 완료","reportPath":".agents/moaworks-subagent/reports/F13-MOBILE-DIRECTORY-API-20260824.md","modifiedFiles":["frontend/mobile-app/App.tsx","frontend/mobile-app/test/mobile-f13-directory-api-contract.test.js"],"verification":[{"command":"focused directory","result":"PASS 5/5"},{"command":"npm test","result":"PASS 74/74"},{"command":"npm run bundle","result":"PASS 8edfc33e67e8ed7f6c5a0e6b0c1cb6a6ff1178ec98a3563220c3ac9aaf6a5988"}],"remaining":["Android release/emulator and operational API actions unverified"],"scopeChange":false,"requirementChange":false,"majorRiskChange":false}
