{
  "taskId": "F13-MOBILE-SCHEDULE-API-20260824",
  "issueId": "F13-MOBILE-SCHEDULE-API",
  "outcome": "SUCCESS",
  "summary": "재작업 3에서 schedules items 계약, 배열형 alertMinutes, timezone 날짜 배치와 중복 POST mutex를 보완했다.",
  "reportPath": ".agents/moaworks-subagent/reports/F13-MOBILE-SCHEDULE-API-20260824.md",
  "modifiedFiles": ["frontend/mobile-app/App.tsx", "frontend/mobile-app/auth-session.js", "frontend/mobile-app/schedule-api.js", "frontend/mobile-app/test/mobile-f13-schedule-api-contract.test.js"],
  "verification": [{ "command": "npm test", "result": "PASS 64/64" }],
  "remaining": ["Android device and actual operational API validation were not run."],
  "directCause": null,
  "evidence": ["User direct approval recorded in workorder commit 59629dc", "Post-approval GET /workspace/calendars wiring rejection", "No product content diff after revert"],
  "attemptedAlternatives": ["Recorded the exact user approval in the workorder and handoff", "Resumed the same developer from the existing RED point", "Kept actual operational calls, data creation, and deployment out of scope", "Reverted incomplete local product changes"],
  "currentState": "Local contracts pass; no operational API call was performed.",
  "remediationProposal": "Run authorized Android/device validation when environment is available.",
  "resumePoint": "Independent review.",
  "scopeChange": false,
  "requirementChange": false,
  "majorRiskChange": false
}
